quotes,created_at,language
".
Le soleil se couchait à l’horizon, projetant une chaude lueur orange dans le ciel. Alors que je me tenais là, en train de tout comprendre, je ne pouvais m'empêcher de me sentir inspiré par la beauté de la nature qui m'entourait. La douce brise transportait le parfum des fleurs sauvages et de l’herbe fraîche, remplissant mes sens de leur doux parfum.

Le chant des oiseaux et le bruissement des feuilles dans le vent ajoutaient à l’atmosphère paisible. C'était comme si le temps avait ralenti, me permettant d'apprécier pleinement le moment et tous ses détails. J'ai fermé les yeux et pris une profonde inspiration, me sentant reconnaissant pour ce moment de calme et de réflexion.

En ouvrant à nouveau les yeux, j'ai remarqué un papillon qui voletait, ses ailes scintillant dans la lumière déclinante. C'était comme s'il dansait à son propre rythme, me rappelant que même dans le calme, il y a du mouvement et de la vie autour de nous.

Je suis resté là pendant ce qui m'a semblé des heures, perdu dans mes pensées et inspiré par la beauté de la nature. Le soleil s'était couché, mais les souvenirs et les sentiments qu'il évoquait resteraient avec moi pour toujours. Je savais que ce moment serait toujours une source d’inspiration et de motivation pour continuer à avancer, aussi difficile que puisse paraître la vie.",2023-11-15 12:04:09.175904,fr
".
""Le succès n'est pas définitif, l'échec n'est pas fatal : c'est le courage de continuer qui compte."" - Winston Churchill

Cette citation nous rappelle que le succès et l’échec ne sont pas des états d’être permanents. Nous devons avoir le courage de continuer même lorsque les choses deviennent difficiles. Il est facile d'abandonner lorsque nous sommes confrontés à des revers ou à des échecs, mais le véritable succès vient de la persévérance face à ces défis.

Les paroles de Churchill nous rappellent que nous ne devrions jamais laisser nos échecs nous définir. Nous devrions plutôt les utiliser comme tremplins vers de futurs succès. Nous devons apprendre de nos erreurs et continuer à grandir et à nous améliorer.

Cette citation rappelle que le chemin vers le succès n’est pas toujours facile, mais qu’il en vaut finalement la peine. Il est important de continuer à avancer même lorsque les choses deviennent difficiles, car avec de la persévérance et de la détermination, nous pouvons réaliser tout ce que nous souhaitons.",2023-11-15 12:04:18.457482,fr
